{
  "$schema": "https://json-schema.org/draft/2020-12/schema",
  "$id": "https://github.com/MohammadBafkar/Polymath/blob/main/registry/schemas/binding.schema.json",
  "title": "Polymath capability provider binding",
  "description": "Validates a `bindings/<provider>/binding.json` inside a connector or infra plugin. A binding is the AUTHORING unit for 'this plugin supplies <provider> for <capability>'. tools/build-capability-index.py reads every binding and GENERATES the `providerPlugins{}` map in registry/schemas/capabilities.json, so that map can never be aspirational — a provider is wired iff a binding exists. The providing plugin is derived from the file path (plugins/<plugin>/bindings/<provider>/binding.json), so a binding cannot claim the wrong plugin. Runtime packaging (how/whether the MCP server launches) is intentionally NOT decided here.",
  "type": "object",
  "additionalProperties": false,
  "required": ["provider", "capability", "transport"],
  "properties": {
    "provider": {
      "description": "Provider id, lower_snake_case. Must appear in this capability's `providers[]` vocabulary in capabilities.json (add it there first to recognise a new provider).",
      "type": "string",
      "pattern": "^[a-z][a-z0-9_]*$"
    },
    "capability": {
      "description": "The capability this binding supplies. Closed vocabulary, mirrors capabilities.schema.json.",
      "enum": [
        "issue_tracker",
        "observability",
        "incident_comms",
        "pager",
        "ci",
        "cloud",
        "runtime",
        "vcs",
        "vulnerability_scanner"
      ]
    },
    "transport": {
      "description": "How the provider is reached. 'mcp' = an MCP server (named by `server`, defined in the plugin's mcp/servers.json render template — a template, never an auto-registered .mcp.json; how it is packaged so only the configured one launches is the deferred Phase 2 decision). 'cli' = a local vendor CLI. 'skill' = no server/CLI; the plugin contributes design/workflow skills only (e.g. infra design plugins).",
      "type": "object",
      "additionalProperties": false,
      "required": ["kind"],
      "properties": {
        "kind": { "enum": ["mcp", "cli", "skill"] },
        "server": {
          "description": "For kind=mcp: the mcpServers key in the plugin's mcp/servers.json render template that serves this provider. Multiple providers may share one server (e.g. github_issues/github_actions/dependabot all ride the github server).",
          "type": "string",
          "minLength": 1
        },
        "command": {
          "description": "For kind=cli: the vendor CLI binary (e.g. terraform, kubectl).",
          "type": "string",
          "minLength": 1
        }
      }
    },
    "mcp": {
      "description": "For kind=mcp: provider IDENTITY — the machine-readable contract tools/mcp-registry.py uses to recognize an MCP server already registered in a host agent (Claude Code, Cursor, Gemini CLI, OpenCode, Codex, VS Code) as THIS provider, so polymath reuses the host's server (the default — plugins never auto-register their own). Declare enough signals to catch the common cases: the server name the vendor's docs use, the npm package (or binary) the official server launches, and the hosted remote URL if one exists.",
      "type": "object",
      "additionalProperties": false,
      "properties": {
        "serverAliases": {
          "description": "Server names under which this provider's MCP is commonly registered (e.g. ['datadog', 'dd']).",
          "type": "array",
          "items": { "type": "string", "minLength": 1 },
          "uniqueItems": true
        },
        "packages": {
          "description": "npm packages / binaries a host-registered stdio server launches for this provider (matched against the npx/uvx/bunx command args).",
          "type": "array",
          "items": { "type": "string", "minLength": 1 },
          "uniqueItems": true
        },
        "remoteUrls": {
          "description": "Hosted remote MCP endpoints for this provider (matched on scheme+host+path).",
          "type": "array",
          "items": { "type": "string", "minLength": 1 },
          "uniqueItems": true
        },
        "envKeys": {
          "description": "Server-native env var names this provider's servers read (e.g. DD_API_KEY). Key names only — never values.",
          "type": "array",
          "items": { "type": "string", "minLength": 1 },
          "uniqueItems": true
        }
      }
    },
    "userConfigKeys": {
      "description": "plugin.json userConfig keys this provider needs (credentials / endpoints). Used to validate that a binding's provider is actually configurable, and by future packaging to scope secrets per provider.",
      "type": "array",
      "items": { "type": "string", "minLength": 1 },
      "uniqueItems": true
    },
    "references": {
      "description": "references/*.md tool docs for this provider.",
      "type": "array",
      "items": { "type": "string", "minLength": 1 },
      "uniqueItems": true
    },
    "title": { "type": "string", "minLength": 1, "maxLength": 80 },
    "description": { "type": "string", "minLength": 1, "maxLength": 300 }
  }
}
