{
  "provider": "statuspage",
  "capability": "incident_comms",
  "transport": {
    "kind": "mcp",
    "server": "statuspage"
  },
  "userConfigKeys": [
    "statuspageApiKey",
    "statuspagePageId"
  ],
  "title": "statuspage",
  "description": "statuspage as incident_comms provider, supplied by polymath-chat.",
  "mcp": {
    "serverAliases": [
      "statuspage"
    ],
    "packages": [
      "@statuspage/mcp-server"
    ],
    "envKeys": [
      "STATUSPAGE_API_KEY",
      "STATUSPAGE_PAGE_ID"
    ]
  }
}
