{
  "provider": "pagerduty",
  "capability": "pager",
  "transport": {
    "kind": "mcp",
    "server": "pagerduty"
  },
  "userConfigKeys": [
    "pagerdutyApiKey"
  ],
  "title": "pagerduty",
  "description": "pagerduty as pager provider, supplied by polymath-paging.",
  "mcp": {
    "serverAliases": [
      "pagerduty"
    ],
    "packages": [
      "@pagerduty/mcp-server"
    ],
    "envKeys": [
      "PAGERDUTY_API_KEY"
    ]
  }
}
