{
  "provider": "linear",
  "capability": "issue_tracker",
  "transport": {
    "kind": "mcp",
    "server": "linear"
  },
  "userConfigKeys": [
    "linearApiKey"
  ],
  "title": "linear",
  "description": "linear as issue_tracker provider, supplied by polymath-tracker.",
  "mcp": {
    "serverAliases": [
      "linear"
    ],
    "packages": [
      "@linear/mcp-server"
    ],
    "remoteUrls": [
      "https://mcp.linear.app/sse"
    ],
    "envKeys": [
      "LINEAR_API_KEY"
    ]
  }
}
